{
  "operator": "lenny",
  "notes": "用样例 review request 验证 capture 的提交反馈层。",
  "profile_store_path": "D:/Lenny_Bcontext/skill-system/relationship-ingestion/runtime/stores/sample-review-store.json",
  "ingestion_result": {
    "skill": "relationship-ingestion",
    "version": "0.1.0",
    "resolved_people": [
      {
        "person_name": "剑锋",
        "resolution_action": "update",
        "matched_existing_person_id": "person_jian_feng",
        "matched_existing_person_name": "剑锋",
        "confidence": "high"
      },
      {
        "person_name": "贵彬",
        "resolution_action": "create",
        "matched_existing_person_id": null,
        "matched_existing_person_name": null,
        "confidence": "high"
      }
    ],
    "profile_updates": [
      {
        "person_name": "贵彬",
        "person_ref": "贵彬",
        "resolution_action": "create",
        "summary": "天气Agent执行层核心接口人。"
      }
    ],
    "person_profiles": [
      {
        "person_name": "剑锋",
        "person_ref": "person_jian_feng",
        "resolution_action": "update",
        "profile_tier": "key",
        "confidence": "high",
        "compiled_truth": {
          "summary": "理性调停型技术负责人。"
        },
        "timeline": [],
        "evidence_summary": {
          "excerpt_count": 1,
          "source_count": 1,
          "last_updated_at": "",
          "key_evidence": ["数据导向，大量用数据和逻辑说话。"]
        },
        "linked_relationships": {
          "detected_as": true,
          "matched_existing_person_id": "person_jian_feng",
          "matched_existing_person_name": "剑锋"
        }
      }
    ],
    "review_bundle": {
      "confirmation_required": true,
      "pending_count": 2,
      "required_candidate_count": 1,
      "candidates": [
        {
          "person_name": "贵彬",
          "priority": "high",
          "needs_confirmation": true,
          "suggested_action": "create",
          "questions": [],
          "fields_to_confirm": [],
          "evidence_preview": ["与斌哥今天上午已聊过多轮，基本聊不通。"]
        },
        {
          "person_name": "萌萌",
          "priority": "medium",
          "needs_confirmation": true,
          "suggested_action": "review",
          "questions": ["萌萌在项目中的角色是什么？"],
          "fields_to_confirm": [],
          "evidence_preview": ["雁然会去找萌萌同步天气项目进展和风险。"]
        }
      ]
    },
    "interaction_summary": {
      "summary": "天气 Agent 分工沟通。"
    },
    "detected_people": [
      { "person_name": "剑锋" },
      { "person_name": "贵彬" }
    ],
    "relationship_edges": [],
    "todos": [],
    "evidence": [],
    "review_flags": []
  },
  "review_decisions": [
    {
      "person_name": "贵彬",
      "final_action": "create",
      "resolved_person_ref": "person_gui_bin",
      "resolved_person_name": "贵彬",
      "profile_tier": "active",
      "notes": "确认纳入天气项目执行层关键接口人。"
    },
    {
      "person_name": "萌萌",
      "final_action": "ignore",
      "notes": "本轮先不建档。"
    }
  ],
  "review_options": {
    "write_store": false,
    "auto_commit_safe_updates": true
  }
}
